Sheet: Sheet1
A1: A | B1: of:=0.7125 -> 0.7125 | C1: Input activation on left edge of accented stem.
A2: mpl | B2: of:=0.5 -> 0.5 | C2: MaxPath left edge of Foot.
A3: dpl | B3: of:=-1.0625 -> -1.0625 | C3: DepPath left edge of Foot.
A4: ml | B4: of:=0.1 -> 0.1 | C4: Max left edge of Foot
A5: dl | B5: of:=-0.5 -> -0.5 | C5: Dep left edge of Foot
A6: ar | B6: of:=0.5 -> 0.5 | C6: Align Head Foot right
A7: dpr | B7: of:=-0.5 -> -0.5 | C7: DepPath right edge of Foot
A8: dr | B8: of:=-0.5 -> -0.5 | C8: Dep right edge of Foot
A9: mpr | B9: of:=0.5 -> 0.5 | C9: MaxPath right edge of Foot
A10: mr | B10: of:=0.1 -> 0.1 | C10: Max right edge of Foot
A11: Sl | B11: of:=0.875 -> 0.875 | C11: Input activation on left edge of dominant “stressless” suffix.
A12: Sr | B12: of:=0.4375 -> 0.4375 | C12: Input activation on right edge of dominant “stressless” suffix.
A13: u | B13: of:=-0.1 -> -0.1 | C13: Uniformity (which ended up not being needed since coalescence was not necessary.)
A14: dep_anch_left_stem | B14: of:=-4 -> -4
A15: anch_r_ft_edge | B15: of:=-1.35 -> -1.35
A16: R | B16: of:=0.375 -> 0.375 | C16: Input activation on right edge of recessive prestessing suffix.
A17: D | B17: of:=0.9375 -> 0.9375 | C17: Input activation on right edge of dominant prestessing suffix.
A18: lr | B18: of:=1/16 -> 0.0625 | C18: Learning rate (not used in the tableaux.)
A21: The input form is shown in the leftmost cell in a row with a green line. Left and right brackets indicate where there is a Foot edge in the input.
A23: (AAA | B23: ml | C23: mpl | D23: dl | E23: dpl | F23: mr | G23: mpr | H23: dr | I23: dpr | J23: ar | K23: u | L23: dep_anch_l_stem | M23: anch_r_ft_edge | N23: H
A24: (AA)A ⟸ | B24: of:=A*ml -> 0.07125 | C24: of:=A*mpl -> 0.35625 | D24: of:=dl*(1-A) -> -0.14375 | E24: of:=dpl*(1-A) -> -0.30546875 | H24: of:=dr*(1-A) -> -0.14375 | I24: of:=dpr -> -0.5 | N24: of:=SUM([.B24:.M24]) -> -0.66546875
A25: A(AA) | B25: of:=A*ml -> 0.07125 | D25: of:=dl*(1-A) -> -0.14375 | E25: of:=dpl -> -1.0625 | H25: of:=dr*(1-A) -> -0.14375 | I25: of:=dpr -> -0.5 | J25: of:=ar -> 0.5 | N25: of:=SUM([.B25:.M25]) -> -1.27875
A26: The winning candidate has better faithfulness to the input Foot at the left edge, which is enough to overcome the reward of Align R on the second candidate.
A28: (AA(S) | B28: ml | C28: mpl | D28: dl | E28: dpl | F28: mr | G28: mpr | H28: dr | I28: dpr | J28: ar | K28: u | L28: dep_anch_l_stem | M28: anch_r_ft_edge | N28: H
A29: (AA)S | B29: of:=A*ml -> 0.07125 | C29: of:=A*mpl -> 0.35625 | D29: of:=dl*(1-A) -> -0.14375 | E29: of:=dpl*(1-A) -> -0.30546875 | H29: of:=dr -> -0.5 | I29: of:=dpr -> -0.5 | N29: of:=SUM([.B29:.M29]) -> -1.02171875
A30: A(AS) ⟸ | B30: of:=A*ml -> 0.07125 | D30: of:=dl*(1-A) -> -0.14375 | E30: of:=dpl -> -1.0625 | F30: of:=mr*Sr -> 0.04375 | G30: of:=mpr*Sr -> 0.21875 | H30: of:=dr*(1-Sr) -> -0.28125 | I30: of:=dpr*(1-Sr) -> -0.28125 | J30: of:=ar -> 0.5 | N30: of:=SUM([.B30:.M30]) -> -0.935
A31: The right edge Foot input on the stressless suffix gives a reward to having that edge surface.
A33: UU(S) | B33: ml | C33: mpl | D33: dl | E33: dpl | F33: mr | G33: mpr | H33: dr | I33: dpr | J33: ar | K33: u | L33: dep_anch_l_stem | M33: anch_r_ft_edge | N33: H
A34: (UU)S | D34: of:=dl -> -0.5 | E34: of:=dpl -> -1.0625 | H34: of:=dr -> -0.5 | I34: of:=dpr -> -0.5 | N34: of:=SUM([.B34:.M34]) -> -2.5625
A35: U(US) ⟸ | B35: of:=A*ml -> 0.07125 | D35: of:=dl*(1-Sl) -> -0.0625 | E35: of:=dpl -> -1.0625 | F35: of:=mr*Sr -> 0.04375 | G35: of:=mpr*Sr -> 0.21875 | H35: of:=dr*(1-Sr) -> -0.28125 | I35: of:=dpr*(1-Sr) -> -0.28125 | J35: of:=ar -> 0.5 | N35: of:=SUM([.B35:.M35]) -> -0.85375
A36: The right edge Foot input on the stressless suffix gives a reward to having that edge surface.
A38: (AA(S)N | B38: ml | C38: mpl | D38: dl | E38: dpl | F38: mr | G38: mpr | H38: dr | I38: dpr | J38: ar | K38: u | L38: dep_anch_l_stem | M38: anch_r_ft_edge | N38: H
A39: (AA)SN | B39: of:=A*ml -> 0.07125 | C39: of:=A*mpl -> 0.35625 | D39: of:=dl*(1-A) -> -0.14375 | E39: of:=dpl*(1-A) -> -0.30546875 | H39: of:=dr -> -0.5 | I39: of:=dpr -> -0.5 | N39: of:=SUM([.B39:.M39]) -> -1.02171875
A40: A(AS)N | B40: of:=A*ml -> 0.07125 | D40: of:=dl*(1-A) -> -0.14375 | E40: of:=dpl -> -1.0625 | F40: of:=mr*Sr -> 0.04375 | G40: of:=mpr*Sr -> 0.21875 | H40: of:=dr*(1-Sr) -> -0.28125 | I40: of:=dpr*(1-Sr) -> -0.28125 | N40: of:=SUM([.B40:.M40]) -> -1.435
A41: AA(SN) ⟸ | B41: of:=ml*Sl -> 0.0875 | C41: of:=mpl*Sl -> 0.4375 | D41: of:=dl*(1-Sl) -> -0.0625 | E41: of:=dpl*(1-Sl) -> -0.1328125 | H41: of:=dr*(1-Sr) -> -0.28125 | I41: of:=dpr -> -0.5 | J41: of:=ar -> 0.5 | N41: of:=SUM([.B41:.M41]) -> 0.0484375
A42: Here, S promotes penult stress through its left Foot edge activation.
A44: (AA(S)(S)N | B44: ml | C44: mpl | D44: dl | E44: dpl | F44: mr | G44: mpr | H44: dr | I44: dpr | J44: ar | K44: u | L44: dep_anch_l_stem | M44: anch_r_ft_edge | N44: H
A45: (AA)SSN | B45: of:=A*ml -> 0.07125 | C45: of:=A*mpl -> 0.35625 | D45: of:=dl*(1-A) -> -0.14375 | E45: of:=dpl*(1-A) -> -0.30546875 | H45: of:=dr -> -0.5 | I45: of:=dpr -> -0.5 | N45: of:=SUM([.B45:.M45]) -> -1.02171875
A46: A(AS)SN | B46: of:=A*ml -> 0.07125 | D46: of:=dl*(1-A) -> -0.14375 | E46: of:=dpl -> -1.0625 | F46: of:=mr*Sr -> 0.04375 | G46: of:=mpr*Sr -> 0.21875 | H46: of:=dr*(1-Sr) -> -0.28125 | I46: of:=dpr*(1-Sr) -> -0.28125 | N46: of:=SUM([.B46:.M46]) -> -1.435
A47: AA(SS)N | B47: of:=ml*Sl -> 0.0875 | C47: of:=mpl*Sl -> 0.4375 | D47: of:=dl*(1-Sl) -> -0.0625 | E47: of:=dpl*(1-Sl) -> -0.1328125 | F47: of:=mr*Sr -> 0.04375 | G47: of:=mpr*Sr -> 0.21875 | H47: of:=dr*(1-Sr) -> -0.28125 | I47: of:=dpr*(1-Sr) -> -0.28125 | M47: of:=anch_r_ft_edge*Sr -> -0.590625 | N47: of:=SUM([.B47:.M47]) -> -0.5609375
A48: AAS(SN) ⟸ | B48: of:=ml*Sl -> 0.0875 | C48: of:=mpl*Sl -> 0.4375 | D48: of:=dl*(1-Sl) -> -0.0625 | E48: of:=dpl*(1-Sl) -> -0.1328125 | F48: of:=mr*Sr -> 0.04375 | H48: of:=dr*(1-Sr) -> -0.28125 | I48: of:=dpr -> -0.5 | J48: of:=ar -> 0.5 | M48: of:=anch_r_ft_edge*Sr -> -0.590625 | N48: of:=SUM([.B48:.M48]) -> -0.4984375
A49: Again, S promotes penult stress through its right Foot edge activation.
A51: UUR)R) | B51: ml | C51: mpl | D51: dl | E51: dpl | F51: mr | G51: mpr | H51: dr | I51: dpr | J51: ar | K51: u | L51: dep_anch_l_stem | M51: anch_r_ft_edge | N51: H
A52: (UU)RR | D52: of:=dl -> -0.5 | E52: of:=dpl -> -1.0625 | H52: of:=dr -> -0.5 | I52: of:=dpr -> -0.5 | L52: of:=dep_anch_l_stem -> -4 | N52: of:=SUM([.B52:.M52]) -> -6.5625
A53: U(UR)R⟸ | D53: of:=dl -> -0.5 | E53: of:=dpl -> -1.0625 | F53: of:=mr*RR -> 0.0375 | G53: of:=mpr*RR -> 0.1875 | H53: of:=dr*(1-RR) -> -0.3125 | I53: of:=dpr*(1-RR) -> -0.3125 | N53: of:=SUM([.B53:.M53]) -> -1.9625
A54: UU(RR) | D54: of:=dl -> -0.5 | E54: of:=dpl -> -1.0625 | F54: of:=mr*RR -> 0.0375 | G54: of:=mpr*RR -> 0.1875 | H54: of:=dr*(1-RR) -> -0.3125 | I54: of:=dpr*(1-RR) -> -0.3125 | J54: of:=ar -> 0.5 | M54: of:=anch_r_ft_edge*RR -> -0.50625 | N54: of:=SUM([.B54:.M54]) -> -1.96875
A55: The leftmost R promotes stess on the previous syllable through its right Foot edge activation. The second R causes the previous R to violate anch_rt_ft_edge.
A57: (AAD)D)R) | B57: ml | C57: mpl | D57: dl | E57: dpl | F57: mr | G57: mpr | H57: dr | I57: dpr | J57: ar | K57: u | L57: dep_anch_l_stem | M57: anch_r_ft_edge | N57: H
A58: (AA)DDR | B58: of:=A*ml -> 0.07125 | C58: of:=A*mpl -> 0.35625 | D58: of:=dl*(1-A) -> -0.14375 | E58: of:=dpl*(1-A) -> -0.30546875 | H58: of:=dr -> -0.5 | I58: of:=dpr -> -0.5 | N58: of:=SUM([.B58:.M58]) -> -1.02171875
A59: A(AD)DR⟸ | B59: of:=A*ml -> 0.07125 | D59: of:=dl*(1-A) -> -0.14375 | E59: of:=dpl -> -1.0625 | F59: of:=mr*D -> 0.09375 | G59: of:=mpr*D -> 0.46875 | H59: of:=dr*(1-D) -> -0.03125 | I59: of:=dpr*(1-D) -> -0.03125 | N59: of:=SUM([.B59:.M59]) -> -0.635
A60: AA(DD)R | D60: of:=dl -> -0.5 | E60: of:=dpl -> -1.0625 | F60: of:=mr*D -> 0.09375 | G60: of:=mpr*D -> 0.46875 | H60: of:=dr*(1-D) -> -0.03125 | I60: of:=dpr*(1-D) -> -0.03125 | M60: of:=anch_r_ft_edge*D -> -1.265625 | N60: of:=SUM([.B60:.M60]) -> -2.328125
A61: AAD(DR) | D61: of:=dl -> -0.5 | E61: of:=dpl -> -1.0625 | F61: of:=mr*D -> 0.09375 | H61: of:=dr*(1-D) -> -0.03125 | I61: of:=dpr -> -0.5 | J61: of:=ar -> 0.5 | M61: of:=anch_r_ft_edge*D -> -1.265625 | N61: of:=SUM([.B61:.M61]) -> -2.765625
A62: The leftmost D promotes stress on the previous syllable through its right Foot edge activation.
A64: UUR)D)D) | B64: ml | C64: mpl | D64: dl | E64: dpl | F64: mr | G64: mpr | H64: dr | I64: dpr | J64: ar | K64: u | L64: dep_anch_l_stem | M64: anch_r_ft_edge | N64: H
A65: (UU)RDD | D65: of:=dl -> -0.5 | E65: of:=dpl -> -1.0625 | H65: of:=dr -> -0.5 | I65: of:=dpr -> -0.5 | N65: of:=SUM([.B65:.M65]) -> -2.5625
A66: U(UR)DD | D66: of:=dl -> -0.5 | E66: of:=dpl -> -1.0625 | F66: of:=mr*D -> 0.09375 | G66: of:=mpr*RR -> 0.1875 | H66: of:=dr*(1-D) -> -0.03125 | I66: of:=dpr*(1-RR) -> -0.3125 | N66: of:=SUM([.B66:.M66]) -> -1.625
A67: UU(RD)D⟸ | D67: of:=dl -> -0.5 | E67: of:=dpl -> -1.0625 | F67: of:=mr*D -> 0.09375 | G67: of:=mpr*D -> 0.46875 | H67: of:=dr*(1-D) -> -0.03125 | I67: of:=dpr*(1-D) -> -0.03125 | M67: of:=anch_r_ft_edge*RR -> -0.50625 | N67: of:=SUM([.B67:.M67]) -> -1.56875
A68: UUR(DD) | D68: of:=dl -> -0.5 | E68: of:=dpl -> -1.0625 | F68: of:=mr*D -> 0.09375 | G68: of:=mpr*D -> 0.46875 | H68: of:=dr*(1-D) -> -0.03125 | I68: of:=dpr*(1-D) -> -0.03125 | J68: of:=ar -> 0.5 | M68: of:=anch_r_ft_edge*D -> -1.265625 | N68: of:=SUM([.B68:.M68]) -> -1.828125
A69: Even though R is to the left of D, D wins at preaccenting because its greater input acitvation results in better Faithfulness to its right Foot edge (mpr and dpr) and it incurs a lower penalty on anch_r_ft_edge.
A71: (AA(S)NR) | B71: ml | C71: mpl | D71: dl | E71: dpl | F71: mr | G71: mpr | H71: dr | I71: dpr | J71: ar | K71: u | L71: dep_anch_l_stem | M71: anch_r_ft_edge | N71: H
A72: (AA)SNR | B72: of:=ml*A -> 0.07125 | C72: of:=mpl*A -> 0.35625 | D72: of:=dl*(1-A) -> -0.14375 | E72: of:=dpl*(1-A) -> -0.30546875 | H72: of:=dr -> -0.5 | I72: of:=dpr -> -0.5 | N72: of:=SUM([.B72:.M72]) -> -1.02171875
A73: A(AS)NR | B73: of:=ml*A -> 0.07125 | D73: of:=dl*(1-A) -> -0.14375 | E73: of:=dpl -> -1.0625 | F73: of:=mr*Sr -> 0.04375 | G73: of:=mpr*Sr -> 0.21875 | H73: of:=dr*(1-Sr) -> -0.28125 | I73: of:=dpr*(1-Sr) -> -0.28125 | N73: of:=SUM([.B73:.M73]) -> -1.435
A74: AA(SN)R | B74: of:=ml*Sl -> 0.0875 | C74: of:=mpl*Sl -> 0.4375 | D74: of:=dl*(1-Sl) -> -0.0625 | E74: of:=dpl*(1-Sl) -> -0.1328125 | F74: of:=mr*Sr -> 0.04375 | H74: of:=dr*(1-Sr) -> -0.28125 | I74: of:=dpr -> -0.5 | M74: of:=anch_r_ft_edge*Sr -> -0.590625 | N74: of:=SUM([.B74:.M74]) -> -0.9984375
A75: AAS(NR)⟸ | B75: of:=ml*Sl -> 0.0875 | D75: of:=dl*(1-Sl) -> -0.0625 | E75: of:=dpl -> -1.0625 | F75: of:=mr*Sr -> 0.04375 | G75: of:=mpr*RR -> 0.1875 | H75: of:=dr*(1-Sr) -> -0.28125 | I75: of:=dpr*(1-RR) -> -0.3125 | J75: of:=ar -> 0.5 | N75: of:=SUM([.B75:.M75]) -> -0.9
A76: S acts as a catalyst to boost the preaccenting effect of R by increasing the reward of mr and ml and reducting penalty of dr, compred to the next tableau.
A78: (AANNR) | B78: ml | C78: mpl | D78: dl | E78: dpl | F78: mr | G78: mpr | H78: dr | I78: dpr | J78: ar | K78: u | L78: dep_anch_l_stem | M78: anch_r_ft_edge | N78: H
A79: (AA)NNR⟸ | B79: of:=ml*A -> 0.07125 | C79: of:=mpl*A -> 0.35625 | D79: of:=dl*(1-A) -> -0.14375 | E79: of:=dpl*(1-A) -> -0.30546875 | H79: of:=dr -> -0.5 | I79: of:=dpr -> -0.5 | N79: of:=SUM([.B79:.M79]) -> -1.02171875
A80: A(AN)NR | B80: of:=ml*A -> 0.07125 | C80: of:=mpl*A -> 0.35625 | D80: of:=dl*(1-A) -> -0.14375 | E80: of:=dpl -> -1.0625 | F80: of:=mr*RR -> 0.0375 | H80: of:=dr -> -0.5 | I80: of:=dpr -> -0.5 | N80: of:=SUM([.B80:.M80]) -> -1.74125
A81: AA(NN)R | D81: of:=dl -> -0.5 | E81: of:=dpl -> -1.0625 | F81: of:=mr*RR -> 0.0375 | H81: of:=dr*(1-RR) -> -0.3125 | I81: of:=dpr -> -0.5 | N81: of:=SUM([.B81:.M81]) -> -2.3375
A82: AAN(NR) | D82: of:=dl -> -0.5 | E82: of:=dpl -> -1.0625 | F82: of:=mr*RR -> 0.0375 | G82: of:=mpr*RR -> 0.1875 | H82: of:=dr*(1-RR) -> -0.3125 | I82: of:=dpr*(1-RR) -> -0.3125 | J82: of:=ar -> 0.5 | N82: of:=SUM([.B82:.M82]) -> -1.4625
A83: R does not have enough input activation on its own to compete with the effects of the left Foot activation of A.
A85: (AAN | B85: ml | C85: mpl | D85: dl | E85: dpl | F85: mr | G85: mpr | H85: dr | I85: dpr | J85: ar | K85: u | L85: dep_anch_l_stem | M85: anch_r_ft_edge | N85: H
A86: (AA)N⟸ | B86: of:=ml*A -> 0.07125 | C86: of:=mpl*A -> 0.35625 | D86: of:=dl*(1-A) -> -0.14375 | E86: of:=dpl*(1-A) -> -0.30546875 | H86: of:=dr -> -0.5 | I86: of:=dpr -> -0.5 | N86: of:=SUM([.B86:.M86]) -> -1.02171875
A87: A(AN) | B87: of:=ml*A -> 0.07125 | D87: of:=dl*(1-A) -> -0.14375 | E87: of:=dpl -> -1.0625 | H87: of:=dr -> -0.5 | I87: of:=dpr -> -0.5 | J87: of:=ar -> 0.5 | N87: of:=SUM([.B87:.M87]) -> -1.635
A88: There is no input activation in the suffix to compete with the left Foot edge of A.
A90: UNN | B90: ml | C90: mpl | D90: dl | E90: dpl | F90: mr | G90: mpr | H90: dr | I90: dpr | J90: ar | K90: u | L90: dep_anch_l_stem | M90: anch_r_ft_edge | N90: H
A91: (UN)N | D91: of:=dl -> -0.5 | E91: of:=dpl -> -1.0625 | H91: of:=dr -> -0.5 | I91: of:=dpr -> -0.5 | N91: of:=SUM([.B91:.M91]) -> -2.5625
A92: U(NN)⟸ | D92: of:=dl -> -0.5 | E92: of:=dpl -> -1.0625 | H92: of:=dr -> -0.5 | I92: of:=dpr -> -0.5 | J92: of:=ar -> 0.5 | N92: of:=SUM([.B92:.M92]) -> -2.0625
A93: With no Foot edge input activation anywhere, the winner is determined by the effects of Align Right.
A95: UN(S) | B95: ml | C95: mpl | D95: dl | E95: dpl | F95: mr | G95: mpr | H95: dr | I95: dpr | J95: ar | K95: u | L95: dep_anch_l_stem | M95: anch_r_ft_edge | N95: H
A96: (UN)S | D96: of:=dl -> -0.5 | E96: of:=dpl -> -1.0625 | F96: of:=mr*Sr -> 0.04375 | H96: of:=dr*(1-Sr) -> -0.28125 | I96: of:=dpr -> -0.5 | N96: of:=SUM([.B96:.M96]) -> -2.3
A97: U(NS)⟸ | B97: of:=ml*Sl -> 0.0875 | D97: of:=dl*(1-Sl) -> -0.0625 | E97: of:=dpl -> -1.0625 | F97: of:=mr*Sr -> 0.04375 | G97: of:=mpr*Sr -> 0.21875 | H97: of:=dr*(1-Sr) -> -0.28125 | I97: of:=dpr*(1-Sr) -> -0.28125 | J97: of:=ar -> 0.5 | N97: of:=SUM([.B97:.M97]) -> -0.8375
A98: S’s input left edge can surface on the left edge and its input right edge on the right edge of a final Foot, even if the left edge ends up in a different part of the suffix complex.
A100: (AANN(S) | B100: ml | C100: mpl | D100: dl | E100: dpl | F100: mr | G100: mpr | H100: dr | I100: dpr | J100: ar | K100: u | L100: dep_anch_l_stem | M100: anch_r_ft_edge | N100: H
A101: (AA)NNS | B101: of:=ml*A -> 0.07125 | C101: of:=mpl*A -> 0.35625 | D101: of:=dl*(1-A) -> -0.14375 | E101: of:=dpl*(1-A) -> -0.30546875 | H101: of:=dr -> -0.5 | I101: of:=dpr -> -0.5 | N101: of:=SUM([.B101:.M101]) -> -1.02171875
A102: A(AN)NS | B102: of:=ml*A -> 0.07125 | D102: of:=dl*(1-A) -> -0.14375 | E102: of:=dpl -> -1.0625 | F102: of:=mr*Sr -> 0.04375 | H102: of:=dr -> -0.5 | I102: of:=dpr -> -0.5 | N102: of:=SUM([.B102:.M102]) -> -2.09125
A103: AA(NN)S | B103: of:=ml*Sl -> 0.0875 | D103: of:=dl*(1-Sl) -> -0.0625 | E103: of:=dpl -> -1.0625 | F103: of:=mr*Sr -> 0.04375 | H103: of:=dr*(1-Sr) -> -0.28125 | I103: of:=dpr -> -0.5 | N103: of:=SUM([.B103:.M103]) -> -1.775
A104: AAN(NS)⟸ | B104: of:=ml*Sl -> 0.0875 | D104: of:=dl*(1-Sl) -> -0.0625 | E104: of:=dpl -> -1.0625 | F104: of:=mr*Sr -> 0.04375 | G104: of:=mpr*Sr -> 0.21875 | H104: of:=dr*(1-Sr) -> -0.28125 | I104: of:=dpr*(1-Sr) -> -0.28125 | J104: of:=ar -> 0.5 | N104: of:=SUM([.B104:.M104]) -> -0.8375
A105: S again promotes penult stress.
A107: UU(S)(S) | B107: ml | C107: mpl | D107: dl | E107: dpl | F107: mr | G107: mpr | H107: dr | I107: dpr | J107: ar | K107: u | L107: dep_anch_l_stem | M107: anch_r_ft_edge | N107: H
A108: (UU)SS | D108: of:=dl -> -0.5 | E108: of:=dpl -> -1.0625 | H108: of:=dr -> -0.5 | I108: of:=dpr -> -0.5 | N108: of:=SUM([.B108:.M108]) -> -2.5625
A109: U(US)S | D109: of:=dl -> -0.5 | E109: of:=dpl -> -1.0625 | F109: of:=mr*Sr -> 0.04375 | G109: of:=mpr*Sr -> 0.21875 | H109: of:=dr*(1-Sr) -> -0.28125 | I109: of:=dpr*(1-Sr) -> -0.28125 | N109: of:=SUM([.B109:.M109]) -> -1.8625
A110: UU(SS)⟸ | B110: of:=ml*Sl -> 0.0875 | C110: of:=mpl*Sl -> 0.4375 | D110: of:=dl*(1-Sl) -> -0.0625 | E110: of:=dpl*(1-Sl) -> -0.1328125 | F110: of:=mr*Sr -> 0.04375 | G110: of:=mpr*Sr -> 0.21875 | H110: of:=dr*(1-Sr) -> -0.28125 | I110: of:=dpr*(1-Sr) -> -0.28125 | J110: of:=ar -> 0.5 | M110: of:=anch_r_ft_edge*Sr -> -0.590625 | N110: of:=SUM([.B110:.M110]) -> -0.0609375000000001
A111: U has no input activation to compete with the effects fo S.
A113: UU(S)N (hypothetical) | B113: ml | C113: mpl | D113: dl | E113: dpl | F113: mr | G113: mpr | H113: dr | I113: dpr | J113: ar | K113: u | L113: dep_anch_l_stem | M113: anch_r_ft_edge | N113: H
A114: (UU)SN | D114: of:=dl -> -0.5 | E114: of:=dpl -> -1.0625 | H114: of:=dr -> -0.5 | I114: of:=dpr -> -0.5 | N114: of:=SUM([.B114:.M114]) -> -2.5625
A115: U(US)N | D115: of:=dl -> -0.5 | E115: of:=dpl -> -1.0625 | F115: of:=mr*Sr -> 0.04375 | G115: of:=mpr*Sr -> 0.21875 | H115: of:=dr*(1-Sr) -> -0.28125 | I115: of:=dpr*(1-Sr) -> -0.28125 | N115: of:=SUM([.B115:.M115]) -> -1.8625
A116: UU(SN)⟸ | B116: of:=ml*Sl -> 0.0875 | C116: of:=mpl*Sl -> 0.4375 | D116: of:=dl*(1-Sl) -> -0.0625 | E116: of:=dpl*(1-Sl) -> -0.1328125 | F116: of:=mr*Sr -> 0.04375 | H116: of:=dr*(1-Sr) -> -0.28125 | I116: of:=dpr -> -0.5 | J116: of:=ar -> 0.5 | M116: of:=anch_r_ft_edge*Sr -> -0.590625 | N116: of:=SUM([.B116:.M116]) -> -0.4984375
A118: UU(S)(S)N (hypoth.) | B118: ml | C118: mpl | D118: dl | E118: dpl | F118: mr | G118: mpr | H118: dr | I118: dpr | J118: ar | K118: u | L118: dep_anch_l_stem | M118: anch_r_ft_edge | N118: H
A119: (UU)SSN | D119: of:=dl -> -0.5 | E119: of:=dpl -> -1.0625 | H119: of:=dr -> -0.5 | I119: of:=dpr -> -0.5 | N119: of:=SUM([.B119:.M119]) -> -2.5625
A120: U(US)SN | D120: of:=dl -> -0.5 | E120: of:=dpl -> -1.0625 | F120: of:=mr*Sr -> 0.04375 | G120: of:=mpr*Sr -> 0.21875 | H120: of:=dr*(1-Sr) -> -0.28125 | I120: of:=dpr*(1-Sr) -> -0.28125 | N120: of:=SUM([.B120:.M120]) -> -1.8625
A121: UU(SS)N | B121: of:=ml*Sl -> 0.0875 | C121: of:=mpl*Sl -> 0.4375 | D121: of:=dl*(1-Sl) -> -0.0625 | E121: of:=dpl*(1-Sl) -> -0.1328125 | F121: of:=mr*Sr -> 0.04375 | G121: of:=mpr*Sr -> 0.21875 | H121: of:=dr*(1-Sr) -> -0.28125 | I121: of:=dpr*(1-Sr) -> -0.28125 | M121: of:=anch_r_ft_edge*Sr -> -0.590625 | N121: of:=SUM([.B121:.M121]) -> -0.5609375
A122: UUS(SN)⟸ | B122: of:=ml*Sl -> 0.0875 | C122: of:=mpl*Sl -> 0.4375 | D122: of:=dl*(1-Sl) -> -0.0625 | E122: of:=dpl*(1-Sl) -> -0.1328125 | F122: of:=mr*Sr -> 0.04375 | H122: of:=dr*(1-Sr) -> -0.28125 | I122: of:=dpr -> -0.5 | J122: of:=ar -> 0.5 | M122: of:=anch_r_ft_edge*Sr -> -0.590625 | N122: of:=SUM([.B122:.M122]) -> -0.4984375
A123: A series of Ss followed by a single recessive stressless affix can promote penuilt stress.
A125: UU(S)NN (hypoth.) | B125: ml | C125: mpl | D125: dl | E125: dpl | F125: mr | G125: mpr | H125: dr | I125: dpr | J125: ar | K125: u | L125: dep_anch_l_stem | M125: anch_r_ft_edge | N125: H
A126: (UU)SNN | D126: of:=dl -> -0.5 | E126: of:=dpl -> -1.0625 | H126: of:=dr -> -0.5 | I126: of:=dpr -> -0.5 | N126: of:=SUM([.B126:.M126]) -> -2.5625
A127: U(US)NN | D127: of:=dl -> -0.5 | E127: of:=dpl -> -1.0625 | F127: of:=mr*Sr -> 0.04375 | G127: of:=mpr*Sr -> 0.21875 | H127: of:=dr*(1-Sr) -> -0.28125 | I127: of:=dpr*(1-Sr) -> -0.28125 | N127: of:=SUM([.B127:.M127]) -> -1.8625
A128: UU(SN)N | B128: of:=ml*Sl -> 0.0875 | C128: of:=mpl*Sl -> 0.4375 | D128: of:=dl*(1-Sl) -> -0.0625 | E128: of:=dpl*(1-Sl) -> -0.1328125 | F128: of:=mr*Sr -> 0.04375 | H128: of:=dr*(1-Sr) -> -0.28125 | I128: of:=dpr -> -0.5 | M128: of:=anch_r_ft_edge*Sr -> -0.590625 | N128: of:=SUM([.B128:.M128]) -> -0.9984375
A129: UUS(NN) (wrong!!) | B129: of:=ml*Sl -> 0.0875 | D129: of:=dl*(1-Sl) -> -0.0625 | E129: of:=dpl -> -1.0625 | F129: of:=mr*Sr -> 0.04375 | H129: of:=dr*(1-Sr) -> -0.28125 | I129: of:=dpr -> -0.5 | J129: of:=ar -> 0.5 | N129: of:=SUM([.B129:.M129]) -> -1.275
A130: Inrerestingly, this form should be impossible according to the template in Dąbkowski (2021) table II., where 2 recessive stessless suffixes cannot follow a dominant stressless suffix.
A132: (AA(S)(S) | B132: ml | C132: mpl | D132: dl | E132: dpl | F132: mr | G132: mpr | H132: dr | I132: dpr | J132: ar | K132: u | L132: dep_anch_l_stem | M132: anch_r_ft_edge | N132: H
A133: (AA)SS | B133: of:=A*ml -> 0.07125 | C133: of:=A*mpl -> 0.35625 | D133: of:=dl*(1-A) -> -0.14375 | E133: of:=dpl*(1-A) -> -0.30546875 | H133: of:=dr -> -0.5 | I133: of:=dpr -> -0.5 | N133: of:=SUM([.B133:.M133]) -> -1.02171875
A134: A(AS)S | B134: of:=A*ml -> 0.07125 | D134: of:=dl*(1-A) -> -0.14375 | E134: of:=dpl -> -1.0625 | F134: of:=mr*Sr -> 0.04375 | G134: of:=mpr*Sr -> 0.21875 | H134: of:=dr*(1-Sr) -> -0.28125 | I134: of:=dpr*(1-Sr) -> -0.28125 | N134: of:=SUM([.B134:.M134]) -> -1.435
A135: AA(SS)⟸ | B135: of:=ml*Sl -> 0.0875 | C135: of:=mpl*Sl -> 0.4375 | D135: of:=dl*(1-Sl) -> -0.0625 | E135: of:=dpl*(1-Sl) -> -0.1328125 | F135: of:=mr*Sr -> 0.04375 | G135: of:=mpr*Sr -> 0.21875 | H135: of:=dr*(1-Sr) -> -0.28125 | I135: of:=dpr*(1-Sr) -> -0.28125 | J135: of:=ar -> 0.5 | M135: of:=anch_r_ft_edge*Sr -> -0.590625 | N135: of:=SUM([.B135:.M135]) -> -0.0609375000000001
A136: S has enough left and right Foot edge input activation to outdo the effects of A.
A138: (AAR) | B138: ml | C138: mpl | D138: dl | E138: dpl | F138: mr | G138: mpr | H138: dr | I138: dpr | J138: ar | K138: u | L138: dep_anch_l_stem | M138: anch_r_ft_edge | N138: H
A139: (AA)R⟸ | B139: of:=ml*A -> 0.07125 | C139: of:=mpl*A -> 0.35625 | D139: of:=dl*(1-A) -> -0.14375 | E139: of:=dpl*(1-A) -> -0.30546875 | H139: of:=dr -> -0.5 | I139: of:=dpr -> -0.5 | N139: of:=SUM([.B139:.M139]) -> -1.02171875
A140: A(AR) | B140: of:=ml*A -> 0.07125 | D140: of:=dl*(1-A) -> -0.14375 | E140: of:=dpl -> -1.0625 | F140: of:=mr*RR -> 0.0375 | G140: of:=mpr*RR -> 0.1875 | H140: of:=dr*(1-RR) -> -0.3125 | I140: of:=dpr*(1-RR) -> -0.3125 | J140: of:=ar -> 0.5 | N140: of:=SUM([.B140:.M140]) -> -1.035
A141: R does not have enough input activation on its own to compete with the effects of the left Foot activation of A.
A143: (AAR)R) | B143: ml | C143: mpl | D143: dl | E143: dpl | F143: mr | G143: mpr | H143: dr | I143: dpr | J143: ar | K143: u | L143: dep_anch_l_stem | M143: anch_r_ft_edge | N143: H
A144: (AA)RR⟸ | B144: of:=ml*A -> 0.07125 | C144: of:=mpl*A -> 0.35625 | D144: of:=dl*(1-A) -> -0.14375 | E144: of:=dpl*(1-A) -> -0.30546875 | H144: of:=dr -> -0.5 | I144: of:=dpr -> -0.5 | N144: of:=SUM([.B144:.M144]) -> -1.02171875
A145: A(AR)R | B145: of:=ml*A -> 0.07125 | D145: of:=dl*(1-A) -> -0.14375 | E145: of:=dpl -> -1.0625 | F145: of:=mr*RR -> 0.0375 | G145: of:=mpr*RR -> 0.1875 | H145: of:=dr*(1-RR) -> -0.3125 | I145: of:=dpr*(1-RR) -> -0.3125 | N145: of:=SUM([.B145:.M145]) -> -1.535
A146: AA(RR) | B146: of:=ml*A -> 0.07125 | D146: of:=dl*(1-A) -> -0.14375 | E146: of:=dpl -> -1.0625 | F146: of:=mr*RR -> 0.0375 | G146: of:=mpr*RR -> 0.1875 | H146: of:=dr*(1-RR) -> -0.3125 | I146: of:=dpr*(1-RR) -> -0.3125 | J146: of:=ar -> 0.5 | M146: of:=anch_r_ft_edge*RR -> -0.50625 | N146: of:=SUM([.B146:.M146]) -> -1.54125
A147: R does not have enough input activation on its own to compete with the effects of the left Foot activation of A.
A149: (AA(S)R) | B149: ml | C149: mpl | D149: dl | E149: dpl | F149: mr | G149: mpr | H149: dr | I149: dpr | J149: ar | K149: u | L149: dep_anch_l_stem | M149: anch_r_ft_edge | N149: H
A150: (AA)SR | B150: of:=ml*A -> 0.07125 | C150: of:=mpl*A -> 0.35625 | D150: of:=dl*(1-A) -> -0.14375 | E150: of:=dpl*(1-A) -> -0.30546875 | H150: of:=dr -> -0.5 | I150: of:=dpr -> -0.5 | N150: of:=SUM([.B150:.M150]) -> -1.02171875
A151: A(AS)R | B151: of:=ml*A -> 0.07125 | D151: of:=dl*(1-A) -> -0.14375 | E151: of:=dpl -> -1.0625 | F151: of:=mr*Sr -> 0.04375 | G151: of:=mpr*Sr -> 0.21875 | H151: of:=dr*(1-Sr) -> -0.28125 | I151: of:=dpr*(1-Sr) -> -0.28125 | N151: of:=SUM([.B151:.M151]) -> -1.435
A152: AA(SR)⟸ | B152: of:=ml*Sl -> 0.0875 | C152: of:=mpl*Sl -> 0.4375 | D152: of:=dl*(1-Sl) -> -0.0625 | E152: of:=dpl*(1-Sl) -> -0.1328125 | F152: of:=mr*Sr -> 0.04375 | G152: of:=mpr*RR -> 0.1875 | H152: of:=dr*(1-Sr) -> -0.28125 | I152: of:=dpr*(1-RR) -> -0.3125 | J152: of:=ar -> 0.5 | M152: of:=anch_r_ft_edge*Sr -> -0.590625 | N152: of:=SUM([.B152:.M152]) -> -0.1234375
A153: S acts as a catalyst to boost the preaccenting effect of R by increasing the reward of mr and ml and reducting penalty of dr, compred to the next tableau.
A155: (AA(S)R)R) (hypo.) | B155: ml | C155: mpl | D155: dl | E155: dpl | F155: mr | G155: mpr | H155: dr | I155: dpr | J155: ar | K155: u | L155: dep_anch_l_stem | M155: anch_r_ft_edge | N155: H
A156: (AA)SRR | B156: of:=ml*A -> 0.07125 | C156: of:=mpl*A -> 0.35625 | D156: of:=dl*(1-A) -> -0.14375 | E156: of:=dpl*(1-A) -> -0.30546875 | H156: of:=dr -> -0.5 | I156: of:=dpr -> -0.5 | N156: of:=SUM([.B156:.M156]) -> -1.02171875
A157: A(AS)RR | B157: of:=ml*A -> 0.07125 | D157: of:=dl*(1-A) -> -0.14375 | E157: of:=dpl -> -1.0625 | F157: of:=mr*Sr -> 0.04375 | G157: of:=mpr*Sr -> 0.21875 | H157: of:=dr*(1-Sr) -> -0.28125 | I157: of:=dpr*(1-Sr) -> -0.28125 | N157: of:=SUM([.B157:.M157]) -> -1.435
A158: AA(SR)R⟸ | B158: of:=ml*Sl -> 0.0875 | C158: of:=mpl*Sl -> 0.4375 | D158: of:=dl*(1-Sl) -> -0.0625 | E158: of:=dpl*(1-Sl) -> -0.1328125 | F158: of:=mr*Sr -> 0.04375 | G158: of:=mpr*RR -> 0.1875 | H158: of:=dr*(1-Sr) -> -0.28125 | I158: of:=dpr*(1-RR) -> -0.3125 | M158: of:=anch_r_ft_edge*Sr -> -0.590625 | N158: of:=SUM([.B158:.M158]) -> -0.6234375
A159: AAS(RR) | B159: of:=ml*Sl -> 0.0875 | D159: of:=dl*(1-Sl) -> -0.0625 | E159: of:=dpl -> -1.0625 | F159: of:=mr*Sr -> 0.04375 | G159: of:=mpr*RR -> 0.1875 | H159: of:=dr*(1-Sr) -> -0.28125 | I159: of:=dpr*(1-RR) -> -0.3125 | J159: of:=ar -> 0.5 | M159: of:=anch_r_ft_edge*RR -> -0.50625 | N159: of:=SUM([.B159:.M159]) -> -1.40625
A160: S does not preaccent even though it has a strong R Ft edge because of its strong L Ft edge which makes it want to postaccent.
A162: (AAD)D) | B162: ml | C162: mpl | D162: dl | E162: dpl | F162: mr | G162: mpr | H162: dr | I162: dpr | J162: ar | K162: u | L162: dep_anch_l_stem | M162: anch_r_ft_edge | N162: H
A163: (AA)DD | B163: of:=A*ml -> 0.07125 | C163: of:=A*mpl -> 0.35625 | D163: of:=dl*(1-A) -> -0.14375 | E163: of:=dpl*(1-A) -> -0.30546875 | H163: of:=dr -> -0.5 | I163: of:=dpr -> -0.5 | N163: of:=SUM([.B163:.M163]) -> -1.02171875
A164: A(AD)D⟸ | B164: of:=A*ml -> 0.07125 | D164: of:=dl*(1-A) -> -0.14375 | E164: of:=dpl -> -1.0625 | F164: of:=mr*D -> 0.09375 | G164: of:=mpr*D -> 0.46875 | H164: of:=dr*(1-D) -> -0.03125 | I164: of:=dpr*(1-D) -> -0.03125 | N164: of:=SUM([.B164:.M164]) -> -0.635
A165: AA(DD) | D165: of:=dl -> -0.5 | E165: of:=dpl -> -1.0625 | F165: of:=mr*D -> 0.09375 | G165: of:=mpr*D -> 0.46875 | H165: of:=dr*(1-D) -> -0.03125 | I165: of:=dpr*(1-D) -> -0.03125 | J165: of:=ar -> 0.5 | M165: of:=anch_r_ft_edge*D -> -1.265625 | N165: of:=SUM([.B165:.M165]) -> -1.828125
A166: The leftmost D promotes stress on the previous syllable through its right Foot edge activation.
A168: UU(S)ND)D) | B168: ml | C168: mpl | D168: dl | E168: dpl | F168: mr | G168: mpr | H168: dr | I168: dpr | J168: ar | K168: u | L168: dep_anch_l_stem | M168: anch_r_ft_edge | N168: H
A169: (UU)SNDD | D169: of:=dl -> -0.5 | E169: of:=dpl -> -1.0625 | H169: of:=dr -> -0.5 | I169: of:=dpr -> -0.5 | N169: of:=SUM([.B169:.M169]) -> -2.5625
A170: U(US)NDD | D170: of:=dl -> -0.5 | E170: of:=dpl -> -1.0625 | F170: of:=mr*Sr -> 0.04375 | G170: of:=mpr*Sr -> 0.21875 | H170: of:=dr*(1-Sr) -> -0.28125 | I170: of:=dpr*(1-Sr) -> -0.28125 | N170: of:=SUM([.B170:.M170]) -> -1.8625
A171: UU(SN)DD | B171: of:=ml*D -> 0.09375 | C171: of:=mpl*Sl -> 0.4375 | D171: of:=dl*(1-D) -> -0.03125 | E171: of:=dpl*(1-Sl) -> -0.1328125 | F171: of:=mr*D -> 0.09375 | H171: of:=dr*(1-D) -> -0.03125 | I171: of:=dpr -> -0.5 | M171: of:=anch_r_ft_edge*Sr -> -0.590625 | N171: of:=SUM([.B171:.M171]) -> -0.6609375
A172: UUS(ND)D⟸ | B172: of:=ml*D -> 0.09375 | D172: of:=dl*(1-D) -> -0.03125 | E172: of:=dpl*(1-D) -> -0.06640625 | F172: of:=mr*D -> 0.09375 | G172: of:=mpr*D -> 0.46875 | H172: of:=dr*(1-D) -> -0.03125 | I172: of:=dpr*(1-D) -> -0.03125 | N172: of:=SUM([.B172:.M172]) -> 0.49609375
A173: UUSN(DD) | B173: of:=ml*D -> 0.09375 | C173: of:=mpl*D -> 0.46875 | D173: of:=dl*(1-D) -> -0.03125 | E173: of:=dpl*(1-D) -> -0.06640625 | F173: of:=mr*D -> 0.09375 | G173: of:=mpr*D -> 0.46875 | H173: of:=dr*(1-D) -> -0.03125 | I173: of:=dpr*(1-D) -> -0.03125 | J173: of:=ar -> 0.5 | M173: of:=anch_r_ft_edge*D -> -1.265625 | N173: of:=SUM([.B173:.M173]) -> 0.19921875
A174: In spite of its right edge activation, S does not preaccent in preference to D partly because of D’s much higher right edge input activation.
A176: (AN(S)D)D) | B176: ml | C176: mpl | D176: dl | E176: dpl | F176: mr | G176: mpr | H176: dr | I176: dpr | J176: ar | K176: u | L176: dep_anch_l_stem | M176: anch_r_ft_edge | N176: H
A177: (AN)SDD | B177: of:=ml*A -> 0.07125 | C177: of:=mpl*A -> 0.35625 | D177: of:=dl*(1-A) -> -0.14375 | E177: of:=dpl*(1-A) -> -0.30546875 | H177: of:=dr -> -0.5 | I177: of:=dpr -> -0.5 | N177: of:=SUM([.B177:.M177]) -> -1.02171875
A178: A(NS)DD⟸ | B178: of:=ml*Sl -> 0.0875 | D178: of:=dl*(1-Sl) -> -0.0625 | F178: of:=mr*D -> 0.09375 | G178: of:=mpr*Sr -> 0.21875 | H178: of:=dr*(1-D) -> -0.03125 | I178: of:=dpr*(1-Sr) -> -0.28125 | N178: of:=SUM([.B178:.M178]) -> 0.025
A179: AN(SD)D | B179: of:=ml*Sl -> 0.0875 | C179: of:=mpl*Sl -> 0.4375 | D179: of:=dl*(1-Sl) -> -0.0625 | E179: of:=dpl*(1-Sl) -> -0.1328125 | F179: of:=mr*D -> 0.09375 | G179: of:=mpr*D -> 0.46875 | H179: of:=dr*(1-D) -> -0.03125 | I179: of:=dpr*(1-D) -> -0.03125 | M179: of:=anch_r_ft_edge*Sr -> -0.590625 | N179: of:=SUM([.B179:.M179]) -> 0.2390625
A180: ANS(DD) | B180: of:=ml*Sl -> 0.0875 | D180: of:=dl*(1-Sl) -> -0.0625 | F180: of:=mr*D -> 0.09375 | G180: of:=mpr*D -> 0.46875 | H180: of:=dr*(1-D) -> -0.03125 | I180: of:=dpr*(1-D) -> -0.03125 | J180: of:=ar -> 0.5 | M180: of:=anch_r_ft_edge*D -> -1.265625 | N180: of:=SUM([.B180:.M180]) -> -0.240625
A181: The margin by which D preaccents instead of S preaccenting is less than in the tableau above because the effects of A add a reward to ml in candidate (A(AS)NDD but it’s not enough.
A183: (AA(S)ND)D) | B183: ml | C183: mpl | D183: dl | E183: dpl | F183: mr | G183: mpr | H183: dr | I183: dpr | J183: ar | K183: u | L183: dep_anch_l_stem | M183: anch_r_ft_edge | N183: H
A184: (AA)SNDD | B184: of:=ml*A -> 0.07125 | C184: of:=mpl*A -> 0.35625 | D184: of:=dl*(1-A) -> -0.14375 | E184: of:=dpl*(1-A) -> -0.30546875 | H184: of:=dr -> -0.5 | I184: of:=dpr -> -0.5 | N184: of:=SUM([.B184:.M184]) -> -1.02171875
A185: A(AS)NDD | B185: of:=ml*A -> 0.07125 | D185: of:=dl*(1-A) -> -0.14375 | F185: of:=mr*D -> 0.09375 | G185: of:=mpr*Sr -> 0.21875 | H185: of:=dr*(1-D) -> -0.03125 | I185: of:=dpr*(1-Sr) -> -0.28125 | N185: of:=SUM([.B185:.M185]) -> -0.0725
A186: AA(SN)DD | B186: of:=ml*D -> 0.09375 | C186: of:=mpl*Sl -> 0.4375 | D186: of:=dl*(1-D) -> -0.03125 | E186: of:=dpl*(1-Sl) -> -0.1328125 | F186: of:=mr*D -> 0.09375 | H186: of:=dr*(1-D) -> -0.03125 | M186: of:=anch_r_ft_edge*Sr -> -0.590625 | N186: of:=SUM([.B186:.M186]) -> -0.1609375
A187: AAS(ND)D⟸ | B187: of:=ml*D -> 0.09375 | D187: of:=dl*(1-D) -> -0.03125 | F187: of:=mr*D -> 0.09375 | G187: of:=mpr*D -> 0.46875 | H187: of:=dr*(1-D) -> -0.03125 | I187: of:=dpr*(1-D) -> -0.03125 | N187: of:=SUM([.B187:.M187]) -> 0.5625
A188: AASN(DD) | B188: of:=ml*D -> 0.09375 | D188: of:=dl*(1-D) -> -0.03125 | F188: of:=mr*D -> 0.09375 | G188: of:=mpr*D -> 0.46875 | H188: of:=dr*(1-D) -> -0.03125 | I188: of:=dpr*(1-D) -> -0.03125 | J188: of:=ar -> 0.5 | M188: of:=anch_r_ft_edge*D -> -1.265625 | N188: of:=SUM([.B188:.M188]) -> -0.203125
A189: The margin by which D preaccents instead of S preaccenting is less than in 2 tableaux above because the effects of A add a reward to ml in candidate (A(AS)NDD but it’s not enough.